{
  "assertion_id": "sha256:f64b6910d9e942fb92c5b22fe28d785080d28208cacb192734865b948173fd48",
  "basis_codes": [
    "EFFECTIVENESS_GATES_NOT_SATISFIED",
    "TARGET_CAPTURE_INTERVAL_OR_FINALIZATION_INADEQUATE"
  ],
  "control_reference": {
    "content_digest": "sha256:f2e9d5aa605488a9864bd5f9c4114b5d805578a59fcf70e98652b395aa735ed3",
    "control_id": "complaint-deny-prevents-serving",
    "control_version": "1"
  },
  "correlation_assertion_refs": [],
  "coverage_assessment": {
    "basis_codes": [
      "TARGET_CAPTURE_INTERVAL_OR_FINALIZATION_INADEQUATE"
    ],
    "control_digest": "sha256:f2e9d5aa605488a9864bd5f9c4114b5d805578a59fcf70e98652b395aa735ed3",
    "coverage_ref": "sha256:125637044b6ba6d8a1aa87a22ea95e1a2f79d98a5d8d9f123c48963f480b1153",
    "interval": {
      "end": "2026-09-05T12:00:12Z",
      "start": "2026-09-05T12:00:02Z"
    },
    "result": "INADEQUATE",
    "support_ref": "sha256:ca8173924d3f9d53f0075246dd9f47568b2103b1992e0d20f293a6244ce5175a"
  },
  "evaluation_status": "INSUFFICIENT_EVIDENCE",
  "exception_paths": [],
  "finding": "CONTROL_EFFECTIVENESS_NOT_DEMONSTRATED",
  "limitations": [
    "This finding concerns exactly one evaluated reconciliation/action and its declared observation boundary; no population-wide inference.",
    "REPRESENTATION_SERVED means the configured target reports serving representation bytes; it does not establish downstream consumption, interpretation or use.",
    "A target-effect exception is not root-cause attribution and makes no claim about why the effect occurred.",
    "A positive finding is conditional on the specific observation interval, capture evidence and clock bounds, not unlimited future prevention.",
    "Content identity and deterministic replay are not cryptographic provenance authentication.",
    "Issuer/namespace qualification checks declarations only; neither independent authentication nor producer enforcement is established."
  ],
  "reconciliation_reference": "sha256:9ffef8be58a1aa72f1c5c324fdbd049d9483ae38fca3bf69e3f4bef7566bad4e",
  "rule_version": "control-attestation/2",
  "schema_version": "1.2",
  "scope": {
    "action": "read",
    "actor": {
      "id": "fixture-agent",
      "namespace": "agent"
    },
    "cardinality": "SINGLE_ACTION",
    "governance_evidence_ref": "sha256:def69f839993c740808a43a74cb7e463dc1d84633028cff199b5eb9db2978391",
    "observation_interval": {
      "end": "2026-09-05T12:00:12Z",
      "start": "2026-09-05T12:00:02Z"
    },
    "resource_id": "complaint-789",
    "resource_type": "employee_complaint",
    "target_id": "complaints-static-v1"
  },
  "source_evidence_refs": [
    "sha256:def69f839993c740808a43a74cb7e463dc1d84633028cff199b5eb9db2978391"
  ],
  "verification_reference": "sha256:34e8820c5cfa86e925d3eb4303610aa4667a43c86971e8a6d6495d277a8b6624"
}
